user,text_review,sentiment_review,sentiment_score,rate,time_visit,language,platform
ngoc t,"Very reasonably priced... salmon or tuna on rice bowl... sauces, fresh vegetable.... my friend is NOT a fan of rice, however, once tasted he really enthused...; Clean, friendly, a must for people that like affordable,clean and healthy food....",POSITIVE,0.995662271976471,5,2016-07-01 00:00,en,tripadvisor
EmilyDoan,"My first time trying poke. The restaurant is cute, great decorations and very friendly staffs. You can choose anything you like for toppings or can rely on their helpful staffs for a wonderful combination. Def come back !!!",POSITIVE,0.9998279809951782,5,2017-01-01 00:00,en,tripadvisor
tonypeezy,Saw Saigon Poke on facebook and was of course skeptical since it recently opened its doors. What a pleasant surprise! Im from California so we have some really great Poke restaurants and Saigon Poke is up there with the best. The environment itself is nice and the service is really attentive with the servers offering insight as to what combination suits your pallet most. This is especially important for new Poke consumers. For me Ive had it many times before so I went straight for the Norwegian Imported salmon bowl with spicy mayo and every topping. Salmon was out of this world fresh and went great with the spicy mayo sauce. Overall great experience. Been back twice and will be back often. A+++++,POSITIVE,0.9996671676635742,5,2017-01-01 00:00,en,tripadvisor
Ugo S,"I spent a very pleasant moment in this place, where I ate a very good poké! the food is very fresh and the staff is attentive.",POSITIVE,0.9998345375061036,5,2017-01-01 00:00,en,tripadvisor
Julien K,"This is was not my first poke rodeo and it's tout this day one my favorite poke place.; ; First of all, I was surprised by how cheap it was given the type of ingredients available. They had tons of really interesting and unique options. I opted for a poke with salmon, ahi tuna, sriracha aioli, mango, masago, seaweed salad, and ogo seaweed. Everything was super fresh and absolute perfection.",POSITIVE,0.9975263476371764,5,2017-02-01 00:00,en,tripadvisor
mathosbob,"Went to poke saigon because I wanted to have a nice alternative from sushi and other classic chirashis. I was not disappointed, everything looks (and tastes fresh) and you have enough topings choice that you can make a really unique meal that tastes unlike anything you've tasted in saigon.",POSITIVE,0.999589502811432,5,2017-02-01 00:00,en,tripadvisor
PierreAlainTieu,"I Went for poke, the 1st in Saigon and for the 1st time of my life. The place is very clean and cute. Staff were really friendly, and could advise on what to pick. Concept was kind of new to me but Absolutely loved it ! I love how poke gives you the ability to customise your bowl. It is very fresh, tasty, and healthy.; ; I Higly recommend this place.",POSITIVE,0.9998763799667358,5,2017-02-01 00:00,en,tripadvisor
151maximep,"In a very nice environnement, with an excellent service, and fresh ingredients. I took the salmon POKE and It's was simply delicious. First time but not the last.",POSITIVE,0.9998712539672852,5,2017-02-01 00:00,en,tripadvisor
richardkQ4927IR,Great salmon and tuna poke in a very friendly place with nice staff. Definitely my new lunch HQ.; So tasty and fresh!,POSITIVE,0.9998722076416016,5,2017-02-01 00:00,en,tripadvisor
Marin P,"Fresh and tasty !; ; Feels nice to have healthy food in HCMC.; ; Staff is very friendly !; ; I came with friends, and although the place is a little hidden in the building, none of us had any probleme to find it",POSITIVE,0.9997652173042296,5,2017-02-01 00:00,en,tripadvisor
706alexandret,"Finally find some amazing healthy food in Saigon ! I didn't know anything about Poke, but the staff guide me through and gave me some recommendation. I don't regret trying ! the food was amazing and the fish was really Fresh !!; ; Highly recommend ! i will be back !",POSITIVE,0.9997878670692444,5,2017-02-01 00:00,en,tripadvisor
jarod496,Petit resto branché avec de bons produits frais et de beaux mélanges de saveurs à concocter.; La deco est top. À tester,POSITIVE,0.9998422861099244,5,2017-02-01 00:00,fr,tripadvisor
Helene_twi,"Im a huge fan of Poke and have been waiting for a place to get my weekly fix since ive moved to Saigon. Im so glad this place has opened, i have lunch there about twice a week and started to use the delivery service for dinner.; I always get the mix brown rice/salad with salmon and spicy tuna, edamame, cherry tomatoes, radish, avocado and the onsen egg that makes it all so tasty.; The spicy tuna is full of flavour with a kick, the ingredients are always fresh - hits the spot every time!! Also love the upbeat and quick service staff!!; The place is small but charming and comfy, the staff is very friendly, and the service pretty quick!; Value-for-money wise it is definitely better than the poke places i used to go in Singapore. i highly reco this place to all healthy food lovers in HCMC.",POSITIVE,0.9997223019599916,5,2017-02-01 00:00,en,tripadvisor
Alex_MGB,"A really good discovery. I didn't know poke but I've found it really tasty. I live in Vietnam and it's hard to find places with fresh and healthy products. So definitely a must try if you like raw fish, salads, with a Japanese twist. The shop is also really nice, and the staff is friendly.",POSITIVE,0.9997774958610536,5,2017-02-01 00:00,en,tripadvisor
tieuminh2017,"Délicieux ! Une bonne association de poisson frais, d’échalotes, de riz blanc, et des légumes au choix... toute la fraicheur dans un bol rond et appétissant. L'ambiance du restaurant est très agréable, nous avons du mal à quitter les lieux pour affronter à nouveau la chaleur extérieure. Excellent endroit pour un déjeuner après une promenade dans le plus beau quartier de Ho Chi Minh.",POSITIVE,0.9998125433921814,5,2017-02-01 00:00,fr,tripadvisor
vercel,"Fresh and tasteful !!! I could have been in Hawaï ! It was my first Poke since a long time. It's good to finally have the opportunity to get one here in Saigon with fresh product. The staff is kind, helpful, they know their job ! I'll be back for sure; It was great !",POSITIVE,0.999810516834259,5,2017-02-01 00:00,en,tripadvisor
annpxx,Stumbled across this pretty cafe on the second floor of the cafe apartment. Tried the Chef recommended bowl and was totally surprised. Full of flavours and the ingredients were so fresh and refreshing!! Love the umami from the blend with the sauces! I've tried alot of Poke in Singapore but I think this is handsdown better. What a surprise and will definitely be back for more!,POSITIVE,0.9993863105773926,5,2017-02-01 00:00,en,tripadvisor
aaronchiang,"First Poke shop in Saigon! Despite being the first, they really do it right. The fish is so fresh and the sauces pair perfectly (spicy mayo!!!) So many toppings and they're delicious! The space itself is cool and chill. Seems geared toward girls who like fresh and healthy food. This is my new go-to spot!",POSITIVE,0.999826729297638,5,2017-02-01 00:00,en,tripadvisor
I6035QQalexc,This place is legit. I've tried poke all over the world and this place is way better than all of them. The fish is so fresh and clean. I recommend the spicy tuna. Their cold pressed juices are also delicious. This is my new favorite place in HCM.,POSITIVE,0.9998258948326112,5,2017-02-01 00:00,en,tripadvisor
oliviert677,"I've heard about this address thanks to a friend, the restaurant is hidden on the Main Street into the second floor of the cafe apartment .When you come into Poke Saigon, you're first surprised by the sophisticated decorative and friendly atmosphere. And then you choose how to compose your bowl , the Chef is really helpful. I ve loved the fresh salmon associated to the crispy onions. So much flavors, so much tastes... and in the same time so healthy !!! I think I've composed the best bowl !; Highly recommended ",POSITIVE,0.999829649925232,5,2017-02-01 00:00,en,tripadvisor
Jnoel1989,"If you want to eat great food, made from fresh products and for a good price in the heart of Saigon, don't hesitate. We went there with friends and had a great time. To add to the experience, the staff was very welcoming. I will definetely go back next time I visit Saigon.",POSITIVE,0.9997509121894836,5,2017-02-01 00:00,en,tripadvisor
Gletcher R,"First (and second) time we had a poke. We were not familiar with the concept, therefore I would like to describe it as a ""create your own california roll in a bowl"". Really nice and honest flavours. They use fresh ingredients and offer a friendly service, eager to explain each ingredient. Poke Saigon is hidden in an old apartment building with all kind of hipster boutiques, coffee bars and pop-up shops. They really stand out from their neighbours in cleanliness, quality and service.",POSITIVE,0.9977104663848876,5,2017-02-01 00:00,en,tripadvisor
patoub12,Lovely place running by lovely guys making awesome food ! You should try once and will come back surely !!!,POSITIVE,0.9998339414596558,5,2017-03-01 00:00,en,tripadvisor
JamieB3248,"The moment I walked in, I was greeted by a sweet girl who explained, in perfect English, how the ordering process works. After telling her some things I wanted, she gave me recommendations and I LOVED my bowl! Both the girls were so sweet and friendly to talk to and the place had a great atmosphere. And fast wifi which never hurts!s",POSITIVE,0.9998457431793212,5,2017-03-01 00:00,en,tripadvisor
StellaL1448,베트남에서 감미료 안쓰는 곳 별로 없는데 여기는 외국인이 운영하는 곳이라 그럴 걱정없이 먹을수 있어 좋아요. 일주일에 한두번은 꼭 들르는 곳이네요 추천!,POSITIVE,0.995241641998291,5,2017-03-01 00:00,ko,tripadvisor
tranngocthuy,"The food creation was eye catching , different tastes and structures combined into one delicious dish ,Fresh food fast and perfect service .",POSITIVE,0.9998273253440856,5,2017-03-01 00:00,en,tripadvisor
Tiến N,"Nice and healthy food for your precious bodies for your curious mind if you haven't try before. There're a pretty wide varieties of toppings you can choose for your base ingredient so you just can't go wrong (unless it's the end of month and your salary payment hasn't come yet lol). Nice space but a bit small, hope you guys can expand your place in near future.; Comeback-ability: it's a yass.",POSITIVE,0.9993001222610474,5,2017-04-01 00:00,en,tripadvisor
BeckyS2718,Super healthy option in Saigon. I am glad I found this place. The salmon were amazing. The staff were super friendly. I will recommend this to anyone visiting Ho Chi Minh city.,POSITIVE,0.9997902512550354,5,2017-04-01 00:00,en,tripadvisor
sonq459,Real clean and modern place. Owner was helpful in choosing the right toppings for my bowl. Also they deliver!!!!!,POSITIVE,0.9998348951339722,5,2017-04-01 00:00,en,tripadvisor
jessinjapan,"Came here on suggestion from the staff at a beer place ... So glad I made the effort to try it out! Great concept and delicious, fresh flavoured food. Spot on, very satisfying and top notch service",POSITIVE,0.999870538711548,5,2017-04-01 00:00,en,tripadvisor
Nikolaj B,I've never tried poke before so this was really a great experience! The staff was very friendly and helped us choose what we should put as topping in the poke. The poke costs 150 000 vnd which is a pretty fair price. The bowl is quite big portion but I eat alot so I couldn't get completely full though. Overall really great!,POSITIVE,0.9990610480308532,5,2017-04-01 00:00,en,tripadvisor
reinout90,First time having poke bowl. It was a perfect lunch with friendly staff and good atmosphere. Just follow the scooters to find the entrance on the second floor. No view of the city unfortunately.,POSITIVE,0.9992237091064452,5,2017-05-01 00:00,en,tripadvisor
trucvy97,The poke is on point. Fresh with all right textures. It's like a firework in the mouth. Need to be back here. Wished I could take this place home with me. Love love love,POSITIVE,0.997995376586914,5,2017-05-01 00:00,en,tripadvisor
yenchau_96,"Its like a mix bowl of your favorite sushi, sounds a bit strange (or at least to me), but its actually very tasty and fresh. They're at very good price also for the quality you get. Staffs are friendly, and they can recommend you well. Will definitely be back!",POSITIVE,0.9998469352722168,5,2017-05-01 00:00,en,tripadvisor
jeannes348,"There is just a little sing outside and it is hidden in a building but do not give up, it is totally worth it! Delicious poke!",POSITIVE,0.999858021736145,5,2017-05-01 00:00,en,tripadvisor
dushyanthana2017,Totally worth itfor the price you pay!.. Delicious food and friendly staff makes this wan to be a regular visiting spot..,POSITIVE,0.999642848968506,5,2017-05-01 00:00,en,tripadvisor
ChuotEm,"Me and my group of ladies loved this new establishment. I wondered about what is Poke. Another edition of Pokemon Go? But no, the food is so amazing, fresh and delicious. Loved it so much. I came back on a Monday and it was closed??? I almost fell in depression... But the owner Manu was nice and helpful. They delivered out to d7 the next day which was so nice to eat with my colleagues. I will surely come back. And the staff and owner are sweet as Pokemon. :)",POSITIVE,0.9998038411140442,5,2017-05-01 00:00,en,tripadvisor
maryyeo,"Poke (pronounced 'po-kay') has been quite a craze in Singapore and we're glad to find a joint here in HCMC. I find it a much wholesome version compared to the salad/juice fad since this is good quality, healthily prepared food that won't make you go hungry after an hour.; ; 150,000vnd (~6.5usd) is actually much cheaper than many of the famous salad bars in Singapore that we usually pay upward of 10bucks for. So each bowl of Poke consists of:; - good portion of Japanese sushi white rice/brown rice; - 2 ice-cream scoopfuls of tuna/salmon sashimi or cooked shrimp; - selection of Japanese sauces (our fav is the sesame sauce); - a whole range of healthy toppings... and you can choose all of them! For the sake of our preschooler, we only got the tomatoes, mushrooms, edamame, surimi and seaweed. The guacamole looked good at an additional 10,000vnd.; ; We were happy that our even preschooler liked and ate a lot of it. Not easy to please our picky eater so...good job. I also liked the friendly service girl. Hope that it can open up as a kiosk in D7 for the health-conscious families!",POSITIVE,0.9922863245010376,5,2017-05-01 00:00,en,tripadvisor
Anh Đ,"My first Poke ever and it was sort of weird to see all the mixing ingredients in one bowl, but heyyyy I coudn’t believe it would taste THAT amazing. The word amazing doesn’t do it’s justice. I had the California Package with Sushi rice and fresh Salmon. Perfect. What made it even more perfect was they even delivered it to my guest house the next day. Friendly people. I am surpriiiiiised! Thanks",POSITIVE,0.9971510767936708,5,2017-05-01 00:00,en,tripadvisor
lanquan,"Maybe I've been in Vietnam for too long, but I felt this is comparable to what I can get in California if not better. Not only that, but the base price of 150k/$7 would be cheaper than anything I can get in the US. They rotate different toppings every once in awhile so it's refreshing to have new options. They make the fruit juice every morning with no additives, and they taste amazing. I'm grateful to have this as a healthy option because I don't get enough protein with my diet in Vietnam. The quality in the fish is amazing, the staff is friendly, atmosphere is nice, and the location in the coffee apartment on Nguyen Hue is perfect. Being the only poke place in Saigon so far, I'm glad the quality is top notch.",POSITIVE,0.999663233757019,5,2017-05-01 00:00,en,tripadvisor
Jethr0G,"Beautiful bowls that you choose yourself. Healthy fresh and tasty! It's in a beautiful building too, but doesn't have the view that other cafes here have.",POSITIVE,0.9972864389419556,5,2017-05-01 00:00,en,tripadvisor
jeremymailisc,"I love everything about Poke Saigon! Healthy food, super tasty, creative menu, friendly staff and cozy place. The best place for a quick bite or a healthy lunch or a light dinner. I will definitely eat there once a week ;) Thank You Poke Saigon for coming to Vietnam!",POSITIVE,0.999817669391632,5,2017-05-01 00:00,en,tripadvisor
ninabmathot,"After a long day of shopping I found Poke Saigon and it made my day! The food is amazing, fresh and you have lots of toppings you can chose in your bowl. I recommend 'the california' bowl with the sesame sauce. Also, the bowl is big enough to still your hunger!",POSITIVE,0.999823272228241,5,2017-06-01 00:00,en,tripadvisor
Jeremy W,Stop by for lunch. It's in a very unique location and the flavor is amazing. You will not be disappointed.,POSITIVE,0.9998806715011596,5,2017-06-01 00:00,en,tripadvisor
aurorecohade17,"The food was fresh and tasteful, the staff is very nice and the overall meal was delicious !; Had a very nice time",POSITIVE,0.9998862743377686,5,2017-06-01 00:00,en,tripadvisor
Ceastyle,"Curious about this apartments building in Saigon that seems to accommodate multiple shops and restaurants, we ended up on the second floor at Poke Saigon. It is a lively and small place that serves delicious and healthy salads bowls and homemade juices. The concept is real simple as you can make your own pike with a base, fish or shrimps, toppings and a sauce. We really recommend this place for its food. The only drawback is the price as it is a bit on the expensive end for what it is. We paid 400k VND for two pokes and two juices.",POSITIVE,0.999057114124298,4,2017-06-01 00:00,en,tripadvisor
Dipnk,"Delicious food, generous portions and friendly & helpful staff! The place itself is also very cute and cosy. Definitely worth a visit.",POSITIVE,0.9998822212219238,5,2017-06-01 00:00,en,tripadvisor
JeanSGP,The meal is super fresh and I like the vibe of that place! Feels good and relaxing specially in the city's heat. Definitely recommend it,POSITIVE,0.9998877048492432,5,2017-06-01 00:00,en,tripadvisor
Jani N,"The location is intriguing itself, inside a large multi-tenant building in the heart of downtown. Opt for the stairs and wander the building for more hidden gems AFTER you eat at Poke Saigon. One bowl is plenty for two people but indulge on your own and you won't regret it! We created a bowl with the help of the friendly and knowledgeable staff with sushi rice, salmon, assorted veg and wasabi sauce topped with guacamole, soy and fried onions. What a lovely, fresh and satisfying lunch that left nothing to be desired. We left satisfied and will definitely be returning for more. Great job Poke Saigon!",POSITIVE,0.999184548854828,5,2017-06-01 00:00,en,tripadvisor
Hoa_Vo,"I'm a big fan of poke, so finding a poke place right smack in the middle of Saigon was a highlight of the day. The poke I usually have is well seasoned and chilled, but the one served here is mixed with the sauce / dressing on the spot.; 5 stars for freshness of ingredients but overall I was let down by the taste.",NEGATIVE,0.9970008730888368,3,2017-06-01 00:00,en,tripadvisor
Anne Kathrine E,"Very recommendable: healthy, delicious, nice staff, cozy surroundings, comfortable interior and spacious!",POSITIVE,0.9998819828033448,5,2017-07-01 00:00,en,tripadvisor
dominikg695,"We really liked the poke bowl with fresh and healthy ingredients. Definitely a refreshing alternative to the standard Vietnamese food!!; ; Also the staff was very nice and helpful!; Room interior is light, welcoming and cozy!",POSITIVE,0.9998733997344972,5,2017-07-01 00:00,en,tripadvisor
Martin K,Cool place with a simple but very delicious salad concept. You build your salad in four steps. The result is great.; ; Both adults and kids loved their salmon.; ; Craft beer and fresh juices to accompany the food.,POSITIVE,0.999874711036682,5,2017-07-01 00:00,en,tripadvisor
StuartH2500,"This little restaurant is a hidden gem in Saigon. Located in Nguyen Hue apartment complex. With a great selection of fresh foods, this healthy alternative to the usual food found in restaurants is a nice new fresh and healthy way of eating. It's now a regular spot for both me and my wife. If you want fresh, healthy and delicious foods I highly recommend you give it a try!",POSITIVE,0.9998239874839784,5,2017-07-01 00:00,en,tripadvisor
N1330KJnicolam,Lovely fresh food. The enthusiastic owner took us through the process of creating our bowls then found us seating upstairs in a cool cafe / boutique. Definitely one of the highlights of our stay in Saigon.,POSITIVE,0.9998557567596436,5,2017-07-01 00:00,en,tripadvisor
Saigon-Foody,"Being the first is always risky but as they say nothing ventured nothing gained. Poke Saigon was not only the first but also arguably has set the bar very high for the kind of quality any competitors would need to meet.; ; Poke Saigon is located in an interesting building, heritage, and can be somewhat difficult to find although it is located on the very popular and busy street Nguyen Hue. Seating is quite sparse as most of their business is takeaway or delivery via services like Vietnammm.; ; They offer a Subway style of make your own Poke bowls or try their pre-made choices which are all very delicious in their own right. I love that they never scrimp on toppings and often times the bowl seems way too small for the amount they give. (in fact i've told them to get bigger bowls). Great for vegetarians and health conscious people, they offer white rice or brown rice and salad as a base.; ; The options of tuna, salmon, or shrimp are always fresh never fishy. Always fresh. The veggies are always crisp, rinsed, and green. Out of all the ingredients they offer i've never seen a non-fresh one. Poke Saigon is about as good as it gets. They are planning on opening a D2 location and i hope also expand the variety of fish they offer. I order Poke once a week from these guys. Bravo!",POSITIVE,0.990629017353058,5,2017-08-01 00:00,en,tripadvisor
dnguyen48,There's only one word to describe my experience : AMAZING! The restaurant is such a hidden gem in the heart of the bustling Saigon. The dish itself consist of so many fresh and healthy ingredient which I like the most. I am myself a fan of sushi so Poke is a really nice alternative whenever I crave the taste of sashimi. The staffs are also very friendly and they seems to genuinely care about their customers. Strongly recommend this place if you want healthy food or just simply want to discover new things. Will come back for sure :),POSITIVE,0.999631643295288,5,2017-08-01 00:00,en,tripadvisor
Tyomonyanko,雑居ビルのような建物の3階にある小さなお店です。; 入り口を入るとすぐにサラダの具材が並んでいて、ハワイの海を想像させるようなカワイイインテリアです。; Pokeは野菜のみか、ライス入りか選べて、さらに30種類くらいあるトッピングと5種類くらいのドレッシングが選べます。野菜もフレッシュで美味しいです。; 飲み物もフレッシュジュースが数種類ありました。; 1人で野菜をたくさん食べたい時に重宝するお店だと思います。,POSITIVE,0.999599277973175,4,2017-08-01 00:00,ja,tripadvisor
Quách N,"Lovely fresh food, healthy , really nice staff, strongly recommend Poke SaiGon, I'll come back for sure ",POSITIVE,0.9998825788497924,5,2017-08-01 00:00,en,tripadvisor
demiVB,"Poke Saigon zit op een plek die je niet gauw zult vinden, maar wat waren wij blij dat we het (dankzij tripadvisor) gevonden hadden! Super lekkere poké bowls voor een prima prijs en hele aardige, goed Engels-sprekende werknemers!",POSITIVE,0.9998430013656616,5,2017-08-01 00:00,nl,tripadvisor
HaniF150,"I love this restaurant! My favourite from all the 9 floors of cafes available.; ; Clean, airy, relaxing ambience.; Modern deco with good lighting.; Great song list, A+; Spoiled for choices of seafood and sauces available.; Food is delicious and fresh. You get to choose multiple free toppings too.; Price is reasonable.; The store manager is very very pleasant. He can give you recommendation if you're indecisive.; Toilet is clean and with bidet installed.; ; There's no meat being served so its a safe option for those looking for halal meal. However they sell beer. So eat at your own discretion.; ; All around, great eating experience! Thank you Poke Saigon!",POSITIVE,0.999782145023346,5,2017-08-01 00:00,en,tripadvisor
timsche,"Mann benötigt eine kleine Erklärung, aber das Prinzip ist doch einfach: Stelle dir eine Bambusschale mit frischen Zutaten zusammen, durchmische sie und genieße es. Die Auswahl reicht von frischen Tunfisch über Avocado bis zu Granatapfel. Dazu eine Auswahl an tollen Soßen und Gewürzen. Das Ergebnis sieht nicht nur ansprechend aus, es schmeckt auch ausgezeichnet. Es könnte das lange erwartete gesunde fast food Konzept sein. Die Bedienung war dazu sehr freundlich und sprach gut englisch.",POSITIVE,0.9997419714927672,5,2017-09-01 00:00,de,tripadvisor
EmCho2,"Opted for a 50/50 sushi rice & salad base, topped with spicy salmon, tuna, spicy mayo, extra fish roe and lots of tasty veggies. Total 160.000 Đong. Yum!",POSITIVE,0.7326422929763794,5,2017-09-01 00:00,en,tripadvisor
pbmhh,"Very good poke, with fresh products ! It's a lovely place, located in an original building. I will definitely come back!",POSITIVE,0.999882698059082,5,2017-09-01 00:00,en,tripadvisor
LTvdw,"Được bạn mình dẫn tới, mình rất ngạc nhiên về nhà hàng, khung cảnh dễ thương, các bạn phục vụ tận tình, đồ ăn thật là tuyệt vời, mình chọn cơm và cá hồi (không nhớ sốt gì hhuhuh) nhưng rất ngon. Chắc chắn mình sẽ tiêp tục đến để ủng hộ quán",POSITIVE,0.9998576641082764,5,2017-09-01 00:00,vi,tripadvisor
