user,text_review,sentiment_review,sentiment_score,rate,time_visit,language,platform
365estherv,Heerlijk verse pokebowls!; Alles is proper en goed verzorgd!; Laat je niet afschrikken door de entree. Het restaurant bevindt zich op de eerste verdieping.,POSITIVE,0.9998512268066406,5,2019-03-01 00:00,nl,tripadvisor
Ellytem,"The ingredients for these Poke bowls were as fresh as they could be and very delicious! It was my first time trying this type of dish and I think I found a new favorite here :) Many different toppings to choose from (some of them very unusual), fresh and flavorful fish, delicious sauces and refreshing juices. This place is number one on TripAdvisor for a reason!; Just a little “warning”: it’s a little hard to find the place because it is located on the first floor of a building and the sign is only very small. Totally worth not giving up the search though!!",POSITIVE,0.9640719890594482,5,2019-03-01 00:00,en,tripadvisor
NinaTi-An,"Nice, fresh, good taste! I really liked the quite environment and that you didn't hear all the noise of the traffic.; ; Very helpful and friendly staff!",POSITIVE,0.9998478889465332,5,2019-03-01 00:00,en,tripadvisor
Will H,"Amazing place. So many healthy options! Lovey staff! Highly recommend. 150,000 dong for a bowl (£4) I’ll be there for dinner toooo!!",POSITIVE,0.9997323155403136,5,2019-03-01 00:00,en,tripadvisor
TrailBlazer809705,不要懷疑 就在咖啡公寓二樓; 搭電梯 出來右手邊 再走幾個階梯上去; 走樓梯應該比較快 不用等; 菜單清楚明瞭 小妹妹顧店,NEGATIVE,0.9804666638374328,5,2019-03-01 00:00,ko,tripadvisor
pauline-antonia,"Wenn man mal keine Lust auf typisch vietnamesische Küche hat, sind die Poke Bowls hier eine super Abwechslung. Die Bedienungen sind alle superlieb und zuvorkommend, Preis-Leistungsverhältnis stimmt auch auf jeden Fall.",POSITIVE,0.9998611211776732,5,2019-03-01 00:00,de,tripadvisor
Bridda,"Great food, excellent service.; Pokebowl was very fresh and they are very generous with the portions.; Special thanks to the hostess whose english was great!",POSITIVE,0.9998794794082642,5,2019-03-01 00:00,en,tripadvisor
rainerhorvath,Das feine Restaurant ist wie auch schon in Hanoi sehr versteckt im 1 Stockwerk.; Die Bedienung ist super freundlich und berät bei der Zusammenstellung der Poke sehr gut. Es war alles sehr frisch zubereitet und sehr schmackhaft. Der einzige ort6an dem ich rohen Fisch esse. Es war sehr ruhig dort und schön gestaltet.; Werden auf alle Fälle wieder kommen,POSITIVE,0.998673677444458,5,2019-03-01 00:00,de,tripadvisor
_M455AE,"The food is very tasty, fresh, and plenty of choices. The staff is efficient and nice. recommended!!!",POSITIVE,0.9998859167099,5,2019-03-01 00:00,en,tripadvisor
StefaniaR0305,"The Poké-Bowl was soooo good! We payed 150’000 Dong and could choose from all ingridients except from two. The staff is very friendly and nice, listens to all your wishes and had put togheter a so yummie Poké-Bowl!; Spot is hidden and can not be found easily because there is no sign on the street. Price is a bit high for vietnamese standards.",POSITIVE,0.9683094620704652,5,2019-03-01 00:00,en,tripadvisor
Joannating,獨自一人不知道要吃什麼，無意間發現的餐廳，配菜選擇很多，平價又健康，吃飯期間有各國的人來用餐，店員英文很好，很有耐心的解釋怎麼點餐,POSITIVE,0.9986289739608764,5,2019-04-01 00:00,zh-tw,tripadvisor
646leonm,"I have never heard of Poke until i visited HCMC this year with my girlfriend and it didnt disappoint.; ; I have attached some pictures of the building it is in as its hard to find.; ; Ita 150k VND for a Poke bowl ao expensive by locak standards but cheal by Western.; ; You can pick a base, fish/meat, sauce a d toppings to go on your poke bowl.; ; Definitely worth a look if you are exploring down town HCMC.; ; Pooookeeee Boooowllll",POSITIVE,0.968622624874115,5,2019-04-01 00:00,en,tripadvisor
Soprano_acadienne,"Very fresh, healthy, amazing food!!; Friendly staff! This first poke bowl won't be my last one, that's for sure! Perfect way to end my day exploring HCMC! Thanks!",POSITIVE,0.999810516834259,5,2019-04-01 00:00,en,tripadvisor
ingridt940,Delicious bowls of yum. We had to wait a few minutes for a table but were offered a free drink which was great. Would definitely recommend,POSITIVE,0.9996954202651978,5,2019-04-01 00:00,en,tripadvisor
globetrottingwaves,Wow! What a great restaurant in Siagon. I loved my bowl which I customized with half salad and rice. The toppings are out of this world and the fresh squeezed juices are refreshing.,POSITIVE,0.9998522996902466,5,2019-04-01 00:00,en,tripadvisor
scritch2018,Nutritious and delicious.; ; A great find from reviews on trip advisor unfortunately the location makes it tricky to find but it's in a big block next to a lot of other shops/restaurants.; ; The staff were very friendly and helpful and offer advice on what will complement your poke bowl.,POSITIVE,0.9994169473648072,5,2019-04-01 00:00,en,tripadvisor
Hraefn,"Place was a lil hard to find but you can probably refer to one of photos in the gallery to find entrance of the building.; ; We were greeted with a vibrant interior decor and two smiley service staff. Though they may not be proficient in English, they were very hospitable and chatty.; ; The order menu is user friendly and offers a huge selection of base, sides and sauces.; ; I've order a mix of brown rice with lettuce, 1+2 extra servings of salmon sashimi cubes with onion, cucumber, guacamole, wakame, nori, mango, edamame, cherry tomato as sides and coriander, spring onions as toppings .; ; I have no complaint for the taste and I was shocked by the price of the total bill as we have only paid ~500k dong for 3 poke bowls and 1 coconut.; ; Ratings in a nutshell:; ; Ambience: 4/5; Food: 5/5; Service: 5/5; Price: 6/5; Revisit: Yes!; ; We have even gone on to order two additional poke bowls as takeaways for our snack later in the day. Will definitely revisit if given a chance to do so.",POSITIVE,0.9582549333572388,5,2019-04-01 00:00,en,tripadvisor
anni98712,"We had lunch today, it was very crowded and we had to wait. But when we started to order, the girl served us really friendly, she sorry for our waiting and carefully introduced the food for us. The food was amazing, fresh and delicous. Lots of choices for the topping. Highly recommend!",POSITIVE,0.9997438788414,5,2019-04-01 00:00,en,tripadvisor
maingac8,So delicious and fresh. I love vegetables. This is the best place to visit with friendly and helpful staff. My friend discovered this speacial type of food concept like a mix of Japanese and Hawaiian food. Would highly recommend,POSITIVE,0.9998332262039183,4,2019-04-01 00:00,en,tripadvisor
louis_m1988,"We discovered this place originally while in Hanoi and we were amazed and were shocked to find the Saigon branch was better with a bigger selection, staff couldn’t help more either was a pleasure and would def go again",POSITIVE,0.9866825342178344,5,2019-04-01 00:00,en,tripadvisor
niklas_ge94,"We ate here yesterday evening and it was really really tasty and healthy. You can create your own bowl and the two girls spoke perfect English and were super helpful. So when you are here in hoc Hi minh and want to eat a healthy and delicious food, you have to come here.; The price is a bit higher then the vietmanese food, but the ingredients are all fresh and we paid for 2 bowls 270.000 vdn - approx. 10 Euro.; ; Go here!",POSITIVE,0.9995261430740356,5,2019-04-01 00:00,en,tripadvisor
katarsiz,"This ppace was great but we passed it at least three times because it is on the 2nd floor of an old building and there are literally ZERO signs to let you know it exists. They need better signage outside on the street and they could benefit by sending flyers and coupons to the neighbor shops as we asked in two places and they had never heard of this place.; ; Restaurant is clean, open and service very friendly.",NEGATIVE,0.948539137840271,4,2019-04-01 00:00,en,tripadvisor
kathrinerudolfsen,Besøkte stedet for lunsj hvor jeg fikk en nydelig poke bowl med ferske og gode råvarer. Hvis man er på jakt etter noe som både er sunt og godt så er dette stedet! Betjeningen er også utrolig hyggelig.,POSITIVE,0.9998687505722046,5,2019-04-01 00:00,no,tripadvisor
HW_2010336,"We had the 'Saigonese' poke bowl. Yum yum yum!; Absolutely DELICIOUS! And the staff are amazing - so chatty, friendly, welcoming and helpful.; Definitely recommend this place.; ",POSITIVE,0.9998867511749268,5,2019-04-01 00:00,en,tripadvisor
Rokelly12,"Super friendly staff. The bowls are delicious and very fresh which is exactly what we felt like. The lady serving us went out of her way to let us know if we want any extra sauces as we were eating to let her know and she’d top us up for free. Great value if you feel like a “western-y” meal that’s delicious, filling and healthy.",POSITIVE,0.999862790107727,5,2019-04-01 00:00,en,tripadvisor
Tam N,We met Uyen she very friendly and helpful especially food was so fresh and tastesty. Highly recommend this place.,POSITIVE,0.999845027923584,5,2019-04-01 00:00,en,tripadvisor
Nanna_Flenskov,It is the best poke place I have been at. You can make your own or choose one made by menu. There was much fish in it and not only salad. The service was also very good and the staff was so sweet and friendly.,POSITIVE,0.99973326921463,5,2019-04-01 00:00,en,tripadvisor
X6519YMstephanieb,Heerlijk en vers! We zijn hier twee keer gaan eten omdat het zo lekker is. Ze hebben sinds kort ook een tweede locatie 10 min verderop.,POSITIVE,0.9997467398643494,5,2019-04-01 00:00,nl,tripadvisor
yul2abba,뭔가 많이 부족한 느낌이네요.. 참치하고 연어도 그닥 신선해보이지 않았어요... 배달해서 먹어서 그런가.. 트립어드바이저 평점이 엄청 좋은데.. 저는 점수를 많이 주지는 못하겠습니다.,NEGATIVE,0.9993857145309448,3,2019-04-01 00:00,ko,tripadvisor
loucoops74,The food was fresh and amazing. The building is so unique and the staff were so friendly and helpful! I would highly recommend going here !!,POSITIVE,0.9998770952224731,5,2019-04-01 00:00,en,tripadvisor
Rubnnn,"Very helpful, friendly staff and great food!!! Poke bowl with fresh food and lots of choice. Recommended!",POSITIVE,0.9998728036880492,5,2019-04-01 00:00,en,tripadvisor
Keegan T,Came here by recommendation with a couple friends. Was not disappointed! I've been traveling southeast Asia for a while and this was the first chance to try reliable raw salmon in a while (Western stomach). Plenty of options for vegetarians.; Khue and the rest of the staff were really friendly to us and made sure we enjoyed our food!,POSITIVE,0.9995784163475036,5,2019-04-01 00:00,en,tripadvisor
Anja B,"I haven't visited the restaurant. I used to order poke from Poke Saigon all the time, the price is a bit steep but I don't mind paying more to eat healthier. Lately, I've been very disappointed though. In the last two orders I felt like I was paying 150,000 vnd for a bowl full of rice. One time I ordered half rice half salad, and got half of a bowl of rice, plus some salad and other toppings (certainly didn't look like half-half to me). The other time, I ordered brown rice and got 2/3 of the bowl filled with white rice.",NEGATIVE,0.9973741769790648,2,2019-04-01 00:00,en,tripadvisor
e3eneko,"Me gusta mucho la idea del Poke, y en este local lo trabajan muy bien, con productos frescos y de primera calidad, tu eliges la opción que más te guste, no puede fallar.",POSITIVE,0.9998194575309752,4,2019-04-01 00:00,es,tripadvisor
TC20190,The poke is very delicious and one can choose as many toppings as one wants:) the girls that work there are very friendly and offered to give us traveling tips as well. You would not regret it ! Very delicious:),POSITIVE,0.999836802482605,5,2019-04-01 00:00,en,tripadvisor
alexmfs,"Very welcoming place and great poke bowls for a perfect lunch.; It is difficult to find it (you need to get in the building n 42 and go up to the second floor) but totally worthy it!; The restaurant is very clean and light, staff was very kind and spoke very good English.; Options to make the bowl were good (types of rice - protein - sauces - toppings....). One bowl costs 150,000 VND which is a totally fair price for the quality of the food !!!; Give it a try if you fancy something different.",POSITIVE,0.9993244409561156,5,2019-04-01 00:00,en,tripadvisor
globe-trotteuse3140,"Excellents bowls, cuisine rafraîchissante. Personnel extrêmement gentil. Le cadre est simple et agréable. Nous recommandons vivement cet endroit si vous souhaitez changer de la cuisine vietnamienne. 350000VND pour deux bowls et deux bouteilles d’eau.",POSITIVE,0.999872088432312,5,2019-04-01 00:00,fr,tripadvisor
Amanda A,"I had amazing poke and a wonderful fresh watermelon juice. The combination options for the poke were very varied and naturally very tasty. I liked that I could have brown rice instead of white. I got very good service from some extremely nice women. The restaurant is a bit hidden, you need to enter a building where a lot of motorbikes are parked. Hit the stairs and on the first floor you get to, you’ll see some nice and quirky shops. Continue ahead and you’ll find Poke Saigon.; Also, the raw food is safe for the “western stomach” ;-)",POSITIVE,0.999660849571228,5,2019-04-01 00:00,en,tripadvisor
anreyxxvi,Kinda difficult to find but the food quality is amazing. Nutritious and delicious. Very fresh ingredients and the staff are really accommodating and speak good english. They're available in Vietnammm too.,POSITIVE,0.9998500347137452,5,2019-04-01 00:00,en,tripadvisor
Drhokipoki,"Natürlich via TripAdvisor auf das Restaurant aufmerksam geworden. Man muss sich ein wenig überwinden in dieses Gebäude hineinzugehen aber es lohnt sich. Kleiner Tipp: lieber die Treppe nehmen, für den Aufzug wird Geld verlangt....; Aber der Aufstieg in die zweite Etage lohnt sich. Es ist extrem lecker. Die Bedienung hilft einem Schritt für Schritt und nimmt sich viel Zeit wenn man es noch nie probiert hat.; Dass wir am nächsten Tag wiederkommen haben wir schon nach dem ersten Löffel festgelegt ",POSITIVE,0.9994916915893556,5,2019-04-01 00:00,de,tripadvisor
sara1342,Das Essen ist wirklich nur zu empfehlen! Wir waren vorher noch nie da und die Angestellten waren super lieb und hilfsbereit. Sie haben sich ca. 5min um uns gekümmert damit wir alles hinbekommen. Der Lachs hat super Qualität und alles ist sehr frisch. Ein Poke ist zwar mit 150000 VND für vietnamesische Verhältnisse „relativ“ teuer aber es lohnt sich und man ist danach total satt!; Also geht dahin!!,POSITIVE,0.9997757077217102,5,2019-04-01 00:00,de,tripadvisor
281annika,- delicious and very fresh ingredients; - they do speak English very well; Absolutely recommend that place.,POSITIVE,0.9998859167099,5,2019-04-01 00:00,en,tripadvisor
ChloeAshleighS,"Once we found the place we were very impressed by the layout and the staff! My partner was given the wrong order, and the staff were so friendly and helpful at replacing it! The food was super fresh and delicious! 100% recommend!",POSITIVE,0.9998574256896972,5,2019-04-01 00:00,en,tripadvisor
Cliffee,The whole family loved it and said can we come back tomorrow. 10/10 for freshness and flavour. This was just the fresh food punch we needed after 8 days in Vietnam.,POSITIVE,0.9997016787528992,5,2019-04-01 00:00,en,tripadvisor
L6581KWdenniss,"Good food, good people. Nice spot central in district 1 really good to reach.; Thank you for the many tips we received for our trip.",POSITIVE,0.9998712539672852,5,2019-04-01 00:00,en,tripadvisor
diemmabiee,"Đồ ăn ngon, tươi sống, nhân viên thân thiện, luôn tươi cười và tư vấn nhiệt tình với khách hàng. Sẽ quay lại sớm :))))",POSITIVE,0.9998270869255066,5,2019-04-01 00:00,vi,tripadvisor
nicoletW8640NI,"Das Essen dort war echt super! Man kann sich seine Bowl selbst zusammenstellen. Als Basis kann zwischen Salat, braunem- und weissen Reis gewählt werden. Bei den Doppings ist für jeden etwas dabei! Die Bedienung war außerdem sehr freundlich und hat uns super Tipps für unseren Trip gegeben.",POSITIVE,0.9997877478599548,5,2019-04-01 00:00,de,tripadvisor
Natthali30,Definitely recommend to visit this place. Everything was so fresh and tasty and the staff is amazingly helpful and nice. Dont miss the chance to taste this incredibly good poke when in Saigon ,POSITIVE,0.9998512268066406,5,2019-04-01 00:00,en,tripadvisor
JessieR02,"This place is brilliant if you are vegetarian, vegan, or a seafood lover! Everything is made right in front of you and you get so many choices. Fresh vegetables, fruit and seafood are available along with a selection of delicious toppings and sauces. The ladies who were working here spoke incredible English and were extremely helpful with dietary requirements. The location is slightly tricky so I would suggest taking a google maps app or screen grab to find it! A complete hidden gem and so healthy and tasty!",POSITIVE,0.9998283386230468,5,2019-04-01 00:00,en,tripadvisor
Bartos999,"Small place. Difficult to find but fantastic experience. It's serving only salads, but when you try it you will love it. It's slightly more expensive than standard low cost restaurants, but it's worth it.",POSITIVE,0.9998509883880616,5,2019-04-01 00:00,en,tripadvisor
385sebastiane,"Really great spot for high quality food. The service level is very high, especially by Vietnam standards aha. I've been here maybe 5 or 6 times and it never fails to disappoint. The staff's English is great and have been trained well to make everyone feel like an important customer. It's a nice little gem. Hard to find the first time, but after that you'll never forget it.; ; Thank you Thanh for making my last visit extra nice. Keep up the amazing work!",POSITIVE,0.9998435974121094,5,2019-04-01 00:00,en,tripadvisor
809katherinel,"We had lunch here - the staff speak brilliant English and were so helpful and friendly helping us create our poke! End result was delicious, so fresh and flavoursome! Would definitely recommend!",POSITIVE,0.9998791217803956,5,2019-04-01 00:00,en,tripadvisor
Matilde L,This place is so cute and the girls working here are the sweetest! Very service minded. The food was delicious and the servings will for sure fill you up! So much food.,POSITIVE,0.9998761415481568,5,2019-04-01 00:00,en,tripadvisor
Amanda M,"Visited yesterday for lunch. Lovely! A little bit hard to find, go up the internal stairs from the street, (pretty sure Google navigated me through the bookshop first!) Attentive staff, fresh food, good choice and price. The staff members came over a couple of times to check if I wanted more sauce etc.",POSITIVE,0.9959312081336976,4,2019-04-01 00:00,en,tripadvisor
Hanhthuc,"Thức ăn tươi, nước sốt ngon và đậm đà, phục vụ nhiệt tình vui vẻ, giá hơi mắc một chút!; Món ăn theo kiểu Hawaii mọi người nên thử!",POSITIVE,0.9996248483657836,5,2019-04-01 00:00,vi,tripadvisor
Pamela E,"This abandoned apartment block has been taken over by hip & happening youngsters who can’t afford retail rent but certainly have artistic flair & spunk to boot . The tiny shops were full of unique individually styled jewellery & fashion . On a hot , very hot day I , with my sister & niece in tow , popped into Poke for a refreshing drink but the friendly ladies at the counter were so helpful & willing that we piled our bowls high with fresh veggies & sesame sauce , & devoured it in minutes; totally delicious. The offer of fresh organic juices was a great way to end the meal . And to top it all , they offered us the glass bottles to take with us so we could fill up with water & not have to buy single use plastic bottles. Well done ladies , round of applause for you .",POSITIVE,0.9997206330299376,5,2019-04-01 00:00,en,tripadvisor
july_lius,Was thinking what to eat during the business trip to HCMC and found this from internet.; Super good poke bowl and fresh juices.; All ingredients are super fresh and we can choose whatever toppings we like.; Staff are super friendly and giving informative advice the moment I stepped in to the counter.; Will definitely come back again!,POSITIVE,0.9994555115699768,5,2019-04-01 00:00,en,tripadvisor
yingsin,"We randomly selected the place from Google, and we were so lucky! Absolutely great service! The food was quite a nice breakaway from the traditional vietnamese food that we had been having. The portion and variety of toppings make this a very fulfilling meal.; The place is also located in a nice area and would be convenient to take a look around afterwards.",POSITIVE,0.9998286962509156,5,2019-04-01 00:00,en,tripadvisor
Fylyb,"I consider myself as a foodie but do not use tripadvisor at all. The bowl in here was so tasty that I had to change my mind and write a few words. So far the best poke I had with great young stuff ladies willing to help you and advise in all directions that would satisfy you in 110 percent. Please, come to Czech republic!",POSITIVE,0.9996941089630128,5,2019-04-01 00:00,en,tripadvisor
kellyjongeling,"Wat een vriendelijk personeel, meteen bij binnenkomst enthousiast ontvangen. Een pokébowl kost 150.000 dong (6€) en je mag 2 soorten vis kiezen, zoveel toppings als je wilt alleen voor sommige moet je een minimaal bedrag bijbetalen.; ; De pokébowl zelf is de moeite waard van een taxirit van 20 minuten. Tijdens het eten komt ze nog even vragen of het lekker is en als we nog iets nodig hebben dat we het gewoon kunnen vragen. Wat een leuke tent, leuk personeel en een echte aanrader!",POSITIVE,0.998418927192688,5,2019-04-01 00:00,nl,tripadvisor
marcus E,"What a wonderful and beutiful little gem in the heart of Saigon.; First of all, it is a bit hidden and hard to find from the street.; But once you found it by going up a staircase and walked 10 meters will you find …",POSITIVE,0.9991281628608704,5,2019-04-10 11:41,en,google_map
Srht01 Srht,"If you like bowls with vegetables or fruits, I recommend that for you.; The restaurant is above a motorbike shop, you have to go through there and go upstairs. The selection for the vegetables is good, but no that good for …",NEGATIVE,0.5933054685592651,4,2019-04-10 11:42,en,google_map
Shyn Marie Ebol,Great food and nice chill place.; ; To get to the place you walk into a motorcylce parking space then a few flight …,POSITIVE,0.9997056126594543,5,2019-04-10 11:42,en,google_map
Dex Nguyen,"Really nice English speaking staff. She was helpful and helped us picking the ingredients for our first time trying Poke. The ingredients are fresh enough and the proportion is as you can see, huge. We asked for and they happily added more …",POSITIVE,0.9998623132705688,5,2019-04-10 11:42,en,google_map
Hanna Mickiewicz,It's a cute place hidden in one of Saigon's apartment buildings. Everything is super clean and there are some comfortable seats. I haven't tried their poke but I had a pitaya bowl. It was tasty but I feel like some extra toppings would make it even better. The smoothie part was frozen - basically like a sorbet.,NEGATIVE,0.9466679096221924,4,2019-04-10 11:43,en,google_map
Shoe “Shoe” Thompson,150k for a bowl.; ; Easy to order with a lot of free reign for what your want. Cool quiet lounge-y …,POSITIVE,0.9958943128585817,5,2019-04-10 11:43,en,google_map
Agi Ro,"One of the hidden treasures of the city. Once you arrive to the address, you must walk into a tiny motorbike parking garage room towards a grand staircase at the back. Then just walk up a floor & you'll be outside again, you will see signs …",POSITIVE,0.9866824150085448,4,2019-04-10 11:43,en,google_map
Roxy,Always amazing poke here! You can make a vegan poke bowl by choosing tofu and sesame-soy dressings with the right toppings. So delicious! It’s 120k vnd for a vegetarian/vegan bowl (150k for a regular bowl).,POSITIVE,0.9995859265327454,5,2019-04-10 11:44,en,google_map
H,"Amazing place. You make your own poke bowl with a base of rice, salad or both, then add raw fish and lots of other ingredients and sauces. Everything is so fresh and delicious and very reasonably priced. Staff is also very friendly and helpful. If I lived in HCMC I would definitely be a regular here.",POSITIVE,0.9998575448989868,5,2019-04-10 11:45,en,google_map
Sascha D'Altobrando,"Very very nice place, it seams to be hosted in an apartment. The girls are very gentle and patient with us foreigners. The food is excellent and served best. Highly recommended. The place is a little bit hidden and not easy to find and the entrance might discourage, but do not hesitate and reach the first floor...you won't regret it 2 …",POSITIVE,0.9997454285621644,5,2019-04-10 11:45,en,google_map
Laura-Christine Schmidt,"Most amazing poke bowl ever! So delicious! And a great variety to chose from. The staff was really friendly, helpful and spoke English perfectly. The restaurant is really cute just a little bit hidden. I will definitely come back!",POSITIVE,0.9998637437820436,5,2019-04-10 11:46,en,google_map
Ed OD,Fantastic poke bowl with about 20 kinds of toppings and 7 sauce options. Every bowl custom made for you. 45k tete craft beer from  6-8pm too. Left stuffed for 150k dong.,NEGATIVE,0.973514974117279,5,2019-04-10 11:46,en,google_map
Jon Sole,Excellent quality food and good topping variety with a great atmosphere. Highly recommend. …,POSITIVE,0.9998846054077148,5,2019-04-10 11:47,en,google_map
Trần Phan Thanh,"Món ăn không quá lạ nhưng cách kết hợp thì độc đáo và rất hợp miệng, nhiều lựa chọn về chủng loại rau cá topping. Không gian đẹp và yên tĩnh khá hợp để đi cặp đôi hoặc nhóm bạn nhỏ. Gửi xe dưới lầu 10k/chiếc.",POSITIVE,0.9997528195381165,4,2019-04-10 11:47,vi,google_map
