user,text_review,sentiment_review,sentiment_score,rate,time_visit,language,platform
faizalbawany,Best experience i had in saigon as the staff were very friendly and the ambience is great. Not to mention the great food as the ingredients were super fresh. Definitely recommend coming here!,POSITIVE,0.9998531341552734,5,2020-03-01 00:00,en,tripadvisor
jinkospinko,"Wonderful establishment with even more wonderful staff, in the midst of a crazy busy city you walk into a tropical oasis to find the warmest smiles greeting you :-) we had the cucumber, guava and honey smoothie along with our food and everything was beautiful, the ambience, food, smoothies and staff we top notch. It’s quite difficult to find through a small car park, up two flights of stairs but once you’re there you never want to leave. If using my photo for directions, walk through the blue car park located behind the left side tree... Thank you for making our experience so enjoyable x x",POSITIVE,0.9998427629470824,5,2020-03-01 00:00,en,tripadvisor
findley2,"Stopped in here while travelling with a group in March 2020 and loved the choices and the services. Despite inundating them at lunchtime with a group of almost 20, the staff got right to work and with no complaints or hesitations got right down to building individual bowls for each of us. The food was fantastic with tasty, fresh sauces and really crisp vegetables. Definitely would visit again!",POSITIVE,0.9997196793556212,5,2020-03-01 00:00,en,tripadvisor
adriandj2020,"it tastes very good and I haven't found it in Indonesia yet, the diving is very friendly and the price is quite affordable",POSITIVE,0.9998131394386292,5,2020-03-01 00:00,en,tripadvisor
foodloversacto,Not authentic poke they use the name only but it is just a mediocre Donbuti..; Your better off going to a Japanese restaurant and having a fresh donburi,NEGATIVE,0.9988000392913818,1,2020-03-01 00:00,en,tripadvisor
Masylu,"Les meilleurs poke en ville. Traversez le garage de motos, montez l'escalier au 2e étage, allez au fond du corridor, vous y trouverez le resto. Pour 160,000 dong, on vous offrira un choix de produits frais pour créer votre bol. Un délicieux repas servi agréablement. Il faut y aller.",POSITIVE,0.999585211277008,5,2020-03-01 00:00,fr,tripadvisor
Z3401RPjonasb,"Amazing staff, very friendly and also very good English skills! The food was super delicious, all Kinds of Variations possible",POSITIVE,0.9998865127563475,5,2020-03-01 00:00,en,tripadvisor
madeleinebr5,Es war mega mega lecker !! Man muss den Laden ein bisschen suchen aber man wird belohnt. Zudem ist die Bedienung sehr lieb. Wir kommen wieder!,POSITIVE,0.999847173690796,5,2020-03-01 00:00,de,tripadvisor
Erica Lin,"Husband and I are from California we live in Taiwan now. While on vacation in Saigon, we had the best poke bowl, ever. It doesn’t get better than this. The flavor is perfect, the price is beyond reasonable. I wish we had one of these in …",POSITIVE,0.9877862930297852,5,2020-03-11 11:40,en,google_map
Oana-Meda Pop,Amazing place where we had some of the best food we sampled in Saigon the ingredients were super fresh and prepared with care.the staff is super attentive to your needs speaks excellent English. they saw that I was sad because of a recent …,POSITIVE,0.9994369149208068,5,2020-03-11 11:40,en,google_map
Tamsyn S,Absolutely delicious! So healthy and fresh. They were careful with mine and my friend’s dietary requirements (Vegetarian & vegan) and you felt good after eating it. …,POSITIVE,0.999883770942688,5,2020-03-11 11:40,en,google_map
Sally Cool,"Great food, healthy style with reasonable price!; It’s located at the 1st floor of the building, so a little bit difficult to find. But trust me, when you see it, it’s like a bright garden lying inside an old …",POSITIVE,0.9991963505744934,5,2020-03-11 11:40,en,google_map
Sue Nguyen,"Quán nhỏ xinh nằm ở tầng 2 chung cư ở Lý Tự Trọng, món ăn ngon, cá hồi tươi, nhiều loại sốt và topping để lựa chọn. Nên thử sốt mè dễ ăn hoặc mayo cay, topping có xoài, đậu nhật, trứng cút ngâm tương rất ngon. Không gian quán siêu xinh, tạo …",POSITIVE,0.99965238571167,5,2020-03-11 11:41,vi,google_map
Jian James,"The rice and salad is great and fresh! A big portion of bowl, definitely good for a guy, with stomach people, suggest to share with two. High recommend",POSITIVE,0.9998397827148438,5,2020-03-11 11:41,en,google_map
Michael San Felipe,"Subway and Chipotle visited Hawaii and decided to use the freshest ingredients to make Poke bowls. Start with rice or salad or both, then choose your protein, then sauces then toppings. The toppings option is a little overwhelming at first, …",NEGATIVE,0.9895824193954468,5,2020-03-11 11:42,en,google_map
Richard Yong,This place is in an old charming building in the heart of town. It's brightly lit and plays cool music. There are many many options on how you can configure yout salad. …,POSITIVE,0.9997367262840272,5,2020-03-11 11:42,en,google_map
Lan T.,"The cutest hidden gem in district 1 for gourmet poke bowls! While located on the first floor of a run down building, this spot is super chic. The staff speaks English and the food is delicious. For 150k VND, you pick your 2 scoops of …",POSITIVE,0.9996953010559082,5,2020-03-11 11:42,en,google_map
Teacher Graham,First Poke and it did not disappoint! Clean and fresh ingredients high quality and made quickly. Beautiful little hidden spot on the second floor with kind staff that had great customer service skills and touched base with us and other customers was nice to see. Worth the dollars for sure will be back again soon :),POSITIVE,0.9998266100883484,5,2020-03-11 11:42,en,google_map
David Harper,"I struggle with how anyone could give this less than 5 stars. It is great food at a great price with friendly service. You pick whether you want salad, rice or brown rice or mix for a base. You pick 2 seafood, and any mix of other fresh …",POSITIVE,0.9990891218185424,5,2020-03-11 11:42,en,google_map
Lilly Luu,"Poke rất tươi và ngon, Pitaya cũng vậy. Không gian của quán đẹp và rất mát mắt nhưng bất tiện là không có dịch vụ trả tiền qua thẻ.",POSITIVE,0.9991493225097656,4,2020-03-11 11:43,vi,google_map
Trang Ngo,Delicious! Cozy atmosphere. I like it a lot. But one portion is a bit too much for me. I wish they serve a smaller bowl.,NEGATIVE,0.9824244379997252,5,2020-03-11 11:43,en,google_map
James Concepcion,This is a hidden gem in the city. Located on the second floor of a residential building that you need to access via a garage with 40 motorbikes and a tiny stairway. This is probably the best Poke I have had. …,POSITIVE,0.9997249245643616,5,2020-03-11 11:44,en,google_map
Mark Dewey,"Subway style choose your own pokebowl. Choose rice, toppings, sauces etc. £5, 150000d. Delicious and filling. Ingredients taste very fresh and staff are incredibly kind and friendly. Worth the trip.",POSITIVE,0.9998338222503662,5,2020-03-11 11:45,en,google_map
Alexander Banks,"Amazing and delicious poke bowls! Hidden away up a sketchy stair case inside a scooter garage, you would never expect such a gem being hidden away. Lovely service with great English skills helped us get a nice bowl  …",POSITIVE,0.9997498393058776,5,2020-03-11 11:45,en,google_map
Uy Le,"Always fresh and has a variety of toppings to choose from. After trying poke at a few different places, I still think Poke Saigon is the best. This location is quite small and cozy, but very nice nonetheless.",POSITIVE,0.9998490810394288,5,2020-03-11 11:46,en,google_map
Mari Ahlquist,"Amazing Poke and really nice and friendly staff! Probably the best poke I've ever had. A modern, calm place to eat.; Not the easiest to find as it is on the first floor.",POSITIVE,0.9997544884681702,5,2020-03-11 11:46,en,google_map
Alvaro Zumaran,"Delicious and nutritious options. If you don't feel like constructing your own bowl, there are recommendations that you can choose from.  Pictured: California and Hawaiin. Prices are on the board (ranges from 150k and up)",POSITIVE,0.9995989203453064,5,2020-03-11 11:46,en,google_map
Milla Parviainen,"Beautiful and delicious bowls, 150k each. Wonderful and friendly staff who walked us through to make our bowls. The location is so cute too!",POSITIVE,0.9998854398727416,5,2020-03-11 11:46,en,google_map
Anh Luu,"The place overall is nice! However, the staff kinda has a discriminative attitude towards my friend, whom used Vietnamese to order food. Later, she told me that the staff has a certain attitude towards her probably she used Vietnamese to order instead of using English, which I amnot sure to be honest. The food is great, though!",POSITIVE,0.9953476786613464,4,2020-03-11 11:46,en,google_map
Melissa Rosero,Been living in HCMC for a year now and this place is legit yummy and safe.  I’ve gotten food poisoning a couple times from raw fish in this city so I’m definitely on the sensitive side and I’ve never had a problem here! 150k isn’t cheap but I don’t recommend eating any cheap raw fish while visiting,POSITIVE,0.9978849291801452,5,2020-03-11 11:47,en,google_map
Charlie Schwartz,"Hidden away upstairs and down the hall, this place is super cute. It’s chipotle style fast casual make your own poke. The staff are really friendly and the food is delicious.",POSITIVE,0.9998788833618164,5,2020-03-11 11:48,en,google_map
Anna Ziouzina,I love poké & this charming little shop (tucked safely away from the hustle & bustle) did not disappoint! Ingredients were all fresh & offered great combination. They have a nice range of poke/fish items & the largest selection of toppings …,POSITIVE,0.9998525381088256,5,2020-03-11 11:48,en,google_map
Daphne Tan,"Hidden gem! If you’re craving for a good pokebowl, this is a must-go. Very good quality and friendly good english speaking staff. A bit hard to find but it’s totally worth it. You can put unlimited toppings and they also have nice juices and pitaya/smoothie bowls  …",POSITIVE,0.9998736381530762,5,2020-03-11 11:48,en,google_map
Jacob .Oestberg,"such good food and great service. just 150.000 VND for a bowl (drink not included). I definitely recommend this place! the picture is of ""the california""",POSITIVE,0.999836564064026,5,2020-03-11 11:49,en,google_map
Nabil Durand,Taste of Hawaii in Saigon. Very fresh and delicious. Vegetarian friendly. Highly recommended.,POSITIVE,0.9998699426651,5,2020-03-11 11:49,en,google_map
richard amero,"Vegan and vegetarian options available; I only came here to keep my vegan gf happy but I absolutely loved it.; Construct your dish yourself (think Subway on crack, but no bread) …",POSITIVE,0.998993456363678,5,2020-03-11 11:49,en,google_map
sue kenny,"Lovely fresh food, lots of flavours. A beautiful meal and wonderful service. Very friendly staff who will guide you through building your perfect poke.",POSITIVE,0.9998875856399536,5,2020-03-11 11:50,en,google_map
Prune,The best place for poke and the cutest place of the city. If you go there you are sure eating high quality dishes and extremely fresh ingredients. Enjoy!,POSITIVE,0.9998852014541626,5,2020-03-11 11:51,en,google_map
Sarah Dörfel,"Very delicious in my kind of taste and the best thing ist, all bowls can be gluten- and lactosefree.",POSITIVE,0.9997172951698304,5,2020-03-11 11:52,en,google_map
Đạt Nguyễn,"The food are fresh, most of things are healthy, a great choice. The staffs are welcoming and helpful in explaining for new comer like me everything",POSITIVE,0.999881386756897,5,2020-03-11 11:52,en,google_map
Timothy Chua,Perfect poke with good service! Staff can speak good English too! 90% of their clients are foreign!,POSITIVE,0.9996706247329712,5,2020-03-11 11:52,en,google_map
Julia Nijland,Super clean place with great healthy food and lovely people! A nice place to escape from the busy streets.,POSITIVE,0.9998847246170044,5,2020-03-11 11:52,en,google_map
Andrey Kaminskiy,Excellent Poke place. Very quiet and nice. Fresh tasty and healthy meal. Rare combination of this three features in one thing.,POSITIVE,0.999886393547058,5,2020-03-11 11:53,en,google_map
Amit Harari,"The best poke I ate! Very nice stuff, polite and helping! Really recommend",POSITIVE,0.9998247027397156,5,2020-03-11 11:53,en,google_map
Javier Eduardo Sánchez,Very tasty  Staff is great and speak English very well. Definitely going back next time I go to Saigon. …,POSITIVE,0.999870538711548,5,2020-03-11 11:53,en,google_map
Byulman Park,"Perfect : delicious, balanced, healthy, good quality, clean and quiet environment, wonderful staff, etc.",POSITIVE,0.9998843669891356,5,2020-03-11 11:53,en,google_map
namidafog,"Delicious light meal, you can choose what you want here. By the way, you need to find the store first before you eat XD",POSITIVE,0.9997425675392152,4,2020-03-11 11:54,en,google_map
Chuong Nguyen Minh,"Các thành phần tươi ngon, hấp dẫn và vừa vị.",POSITIVE,0.9998812675476074,4,2020-03-11 11:54,vi,google_map
Luka Ruklic,"The place is a bit hard to find, but the premises are quiet and lovely decorated. The staff is English-speaking, very friendly and will help you create your own bowl with rice or salad base, various sea food and toppings. The price is a bit …",POSITIVE,0.9998069405555724,5,2020-03-11 11:55,en,google_map
Lorky Lor,"It's on the 2nd floor. Go through the bikes parked at the front and take a flight of stairs at the end.; The sides are unlimited, you can ask for as much as the bowl can hold!",NEGATIVE,0.848000705242157,5,2020-03-11 11:55,en,google_map
Beth Sands,Delicious poké bowls and super friendly service  …,POSITIVE,0.9998137354850768,5,2020-03-11 11:55,en,google_map
Co Ho,Delicious pokebowls at a reasonable price. Lot of options for your bowl as well.,POSITIVE,0.9997641444206238,5,2020-03-11 11:55,en,google_map
Saigon Wanderlust,"We were impressive with this concept in another building and wanted to discover the second one. The food was still delicious as if we could eat everyday. The staffs speak English perfectly and are really polite. 150k for one bowl with everything you can choose, fresh and healthy!",POSITIVE,0.9998663663864136,5,2020-03-11 11:55,en,google_map
Nat Lee,"Had lunch here and it was very good. A lot of different ingredients to chose from, rice, salad or mix of both as base, salmon and tuna, natural or spicy, shrimps, octopus, etc. and a variety of different dressings. …",POSITIVE,0.9998419284820556,4,2020-03-11 11:56,en,google_map
Justin Hill,"I had never had poke bowls before coming here... It was so good. So fresh, ample size. I asked for heaps of toppings and they just loaded if up. Shrimp was a highlight of my bowl. If I was her in Saigon longer I'd be back to eat again :D",POSITIVE,0.9986779093742372,5,2020-03-11 11:56,en,google_map
Than Nguyen,The place is a bit hard to find (go up through the parking garage) but the food is very good! You are free to customize your pokebowl any way you want and there are many options available. If you're unsure about what to get the staff is very helpful and willing to make some recommendations. Enjoyable place all in all.,POSITIVE,0.9998257756233216,5,2020-03-11 11:57,en,google_map
Lukas,"Unbelievable good bowl, was better than in Hawaii! And a lot cheaper ;)",POSITIVE,0.9982873797416688,5,2020-03-11 11:57,en,google_map
Adi Nissim,Great place. Great and fresh food. The staff are super nice and speak great English.,POSITIVE,0.999886155128479,5,2020-03-11 11:59,en,google_map
Claire Menzel Hill,"Simply delicious meal! The staff were very friendly and spoke English very well. They were happy to explain and give recommendations based on my preferences. It's more than enough food, and only AUD$9. The food is fresh, colourful and tastes amazing. Air con, WiFi, cute couches and benches,  what more could you want?",POSITIVE,0.9998403787612916,5,2020-03-11 11:59,en,google_map
Yann Chrétien,"Amazing staff, relaxing place. The concept, the quality of meals, or drinks that are suggested just WoW, really simple but so good, love it this is for the reason i went back after a friend show me the place for a lunch. Really amazing idea, quality, staff all match together for a reasonnable price. Keep going, will be back, YummY",POSITIVE,0.9998351335525512,5,2020-03-11 11:59,en,google_map
Lara Hanna,Our first time trying poke and it was delicious! The ingredients are so fresh and the staff is super friendly. Great English too! The smoothie bowl is also yummy!,POSITIVE,0.9998464584350586,5,2020-03-11 11:59,en,google_map
Shan L,We have spent a very good moment at this place. The bowls are very fresh and delicious. Special thanks to Thanh the lady who served us tonight. She explained to us the menu carefully and was very nice,POSITIVE,0.9998733997344972,5,2020-03-11 12:00,en,google_map
Natha Lie,Super delicious fresh food and amazing staff!!,POSITIVE,0.9998921155929564,5,2020-03-11 12:00,en,google_map
Mandys_Adventures Caldwell,"Omg!! So delicious! And the serving size is soooo generous. Very fresh, def be back daily until I leave! The girls are all so friendly and gave me tips on places to go. 10/10 for sure!",POSITIVE,0.99986469745636,5,2020-03-11 12:00,en,google_map
Paul Douglas,"Great food and many selections to choose from. The salmon was very fresh, and the wasabi Mayo had a good kick to it. Although a little hard to find, it's definitely worth the visit. Super friendly staff.",POSITIVE,0.9998273849487304,5,2020-03-11 12:00,en,google_map
Marie Zoé,"Beautiful little place, fresh ingredients and amazing customer service: thank you !",POSITIVE,0.9998886585235596,5,2020-03-11 12:00,en,google_map
Nick Melhuish,"Truly a wonderful place with AMAZING attentive staff, delicious food and a cool environment! I will certainly be back. We’re vegans and the vegan options was perfect! Shout out to Mai Linh for making the whole experience even better :)",POSITIVE,0.9998764991760254,5,2020-03-11 12:00,en,google_map
John Kelaiditis,"Went there after reading tripadvisor ratings but when we saw the place ran away imediately. Through a motorbike parking, up the stairs to the first floor down a corridor with several doors there was a room with some tables. 2 persons were …",NEGATIVE,0.9982176423072816,1,2020-03-11 12:01,en,google_map
chris brunero,"Such an amazing little find just out of the main tourist attractions, a nice outdoor area to sit and get away from the horns of HCM streets. The food was delicious and good sized portions and the staff were incredible at walking me through …",POSITIVE,0.9998714923858644,5,2020-03-11 12:01,en,google_map
Samuel Perl,Fresh and delightful bowls and a super friendly staff,POSITIVE,0.9998804330825806,5,2020-03-11 12:01,en,google_map
Lyon Sim,"I love this place. Chic and chill. Healthy delicious food. They're located upstairs, level 2 even though the sign on ground floor says located at level 1. Under 200,000vnd per bowl",POSITIVE,0.999776303768158,5,2020-03-11 12:02,en,google_map
Denise Jonker,Absolutely delicious! Very decently priced as well! Best food I had in a long long time. Will probably go back again tonight.,POSITIVE,0.9998708963394164,5,2020-03-11 12:02,en,google_map
Mallory Starkman,"Delicious and great value! Best poke bowl I have possibly ever had. Clean and airy too, highly recommend!",POSITIVE,0.9998841285705566,5,2020-03-11 12:02,en,google_map
Quốc Dũng Lư,- Cửa hàng nằm trên tầng 1. gửi xe ở dưới đất bất tiện.; - 7h30 tối mà 1 số món đã hết. Oder xong 10p sau lại báo hết tiếp mà ko có lời xin lỗi. …,NEGATIVE,0.9954597353935242,1,2020-03-11 12:02,vi,google_map
Giuseppe Guglielmotti,"The food is absolutely amazing, the place so cozy and friendly (even if it is a little tricky to find as it is at the 2 floor of a building that seems a parking) and the staff probably is the best thing, welcoming and helpful! Must try!",POSITIVE,0.9998328685760498,5,2020-03-11 12:02,en,google_map
Callan,"Great place, super friendly staff. The gentleman who served us told us this is the better location out of the two as you can sit down here to eat, the other one is very busy.; Had free WiFi too.",NEGATIVE,0.7237801551818848,5,2020-03-11 12:02,en,google_map
John Soh,"So tasty...so many toppings and flavors makes it so cerebrally satisfying. The 2 girls there Hue and especially Vy are so enthusiastic and positive. They speak English very nicely, which seems to be rare in HCM. Interior is chic and very …",POSITIVE,0.9998878240585328,5,2020-03-11 12:02,en,google_map
Maria,Hidden on the first floor after you pass the scooter garage. Amazing Poke bowls reasonably priced. Everything fresh and delicious. The staff speaks english!,POSITIVE,0.9998486042022704,5,2020-03-11 12:02,en,google_map
Eric Woodard,"I wanted to add my 5 stars, and everything I wanted to say is more eloquently written in the other reviews: delicious food, super-friendly staff, beautiful space, a bit difficult to find.  So worth it. Such a great experience.",POSITIVE,0.999870777130127,5,2020-03-11 12:02,en,google_map
Rakik,"An amazing gem in Saigon, not easy to spot but that adds to its charm. Fresh bowls of awesome flavours, the perfect stop for lunch.",POSITIVE,0.999859094619751,5,2020-03-11 12:03,en,google_map
Jack Ross,"Excellent service with high quality grade tuna, shrimp, and octopus. It's quickly becoming our favorite spot to eat in Saigon.",POSITIVE,0.9995669722557068,5,2020-03-11 12:03,en,google_map
Max In Saigon,"Focuses a lot in foreigners, so if you're a Viet, you'll get treated a little... ""less"". But hey, otherwise it's great for travelers, expats, foreigners: food is never bad, good services.",POSITIVE,0.9993465542793274,4,2020-03-11 12:03,en,google_map
Mel,Super tasty!! I got a vegan bowl and the staff was pretty aware of what was vegan or not. They were super helpful and friendly.,POSITIVE,0.9994813799858092,5,2020-03-11 12:03,en,google_map
Ankita Ghosh,"Fresh poke ingredients, great variety, lovely staff, cute little seating space, oh and they deliver to. My go-to for comfort lunches, any day.",POSITIVE,0.999851942062378,4,2020-03-11 12:03,en,google_map
Veronika Vrábelová,This was the best poke I have ever tried. Delicious! Thank you. And also very polite and friendly staff here. Definitely recommend this place.,POSITIVE,0.9998761415481568,5,2020-03-11 12:03,en,google_map
Landon M.,"I’ve tried many poke restaurants and this is the best I’ve ever had. It looks just like the pictures, they give very generous portions and the atmosphere is pleasant.",POSITIVE,0.9998835325241088,5,2020-03-11 12:03,en,google_map
yrtwo,As a tourist i was quite comprehensive about eating here as it is not quite authentics. But this is hands down the best food i ate here in vietnam. I bet this is one of the best poke in the world,POSITIVE,0.9996163845062256,5,2020-03-11 12:03,en,google_map
Khanh Bui,"Excellent customer service. They automatically gave me a free drink as an apology for making me wait without even prompted. Oh, and the food's great too.",POSITIVE,0.9996355772018432,5,2020-03-11 12:03,en,google_map
Jan Peters,bit pricey but staff is very helpful and for the fixed bowl price you are free to choose from all ingredients they offer which is super cool,POSITIVE,0.9994738698005676,5,2020-03-11 12:03,en,google_map
Mallory Rose,Food was really good and price was good. Staff was super helpful and nice. I’m vegan and gluten free and they knew exactly what I could and couldn’t have.,POSITIVE,0.9997785687446594,5,2020-03-11 12:03,en,google_map
Alex Cabrera,Best poke bowl I've ever had!,POSITIVE,0.9995269775390624,5,2020-03-11 12:04,no,google_map
Carlota,"Delicious and fresh poke bowls! The place is beautiful and cozy, and the staff is helpful and super nice! Definetely recommended!",POSITIVE,0.9998832941055298,5,2020-03-11 12:04,en,google_map
Hồ Ngọc khánh,Hôm nay là tui thấy làm nhanh á,POSITIVE,0.999244213104248,5,2020-03-11 12:04,vi,google_map
Jacques LE GOUIS,"Excellent experience at this place, the personal was friendly and at ease with speaking english, the place was comfortable, and the food really good and fresh! I highly recommand it!",POSITIVE,0.9998835325241088,5,2020-03-11 12:05,en,google_map
Jonas Eicher,"Friendly, English speaking staff, excellent poke bowls! (150k for regular bowl at Jan 2019)",POSITIVE,0.9995806813240052,5,2020-03-11 12:05,en,google_map
Bich Hoang,super fresh and friendly staffs. good thing if you’re a sashimi lover! they dont accept cards though,POSITIVE,0.9976019263267516,5,2020-03-11 12:05,en,google_map
WS Lee,"Everything is perfect except the price is on the high side.; 150,000 for 1 bowl. Very healthy meal though",POSITIVE,0.9997679591178894,5,2020-03-11 12:05,en,google_map
Tess Delighted,"Best poke bowl I have ever had, kindest staff, beautiful interior! Cannot get any better! Thank you so much",POSITIVE,0.9997279047966005,5,2020-03-11 12:05,en,google_map
M,Best poke restaurant in Saigon!,POSITIVE,0.9992479681968688,5,2020-03-11 12:05,fr,google_map
Sheila Janes,"Great idea. Healthy food, big portion. Not so expensive for lunch.",POSITIVE,0.9995842576026917,5,2020-03-11 12:06,en,google_map
Rebecca Granot,Chique tasty and very welcoming,POSITIVE,0.9998764991760254,5,2020-03-11 12:06,en,google_map
Brett Marshall,Great fresh food at a reasonable price. Ate here twice in 2 days... Love it.,POSITIVE,0.9998631477355956,5,2020-03-11 12:06,en,google_map
Carolin S.,Amazing place to have something unique to eat. I really loved the poke bowl ,POSITIVE,0.999871015548706,5,2020-03-11 12:06,en,google_map
LINH NGUYỄN NGỌC YẾN,150k for a regular set.,NEGATIVE,0.9552412629127502,4,2020-03-11 12:06,no,google_map
JUNGGYU NAM,Delicious and clean condition,POSITIVE,0.9998784065246582,5,2020-03-11 12:06,en,google_map
